{
  "schemaVersion": "1",
  "code": "AM-RULE-001",
  "severity": "error",
  "blocking": true,
  "path": "/selections/4",
  "messageKey": "diagnostic.compositorCardinalityExceeded",
  "params": {
    "count": 2,
    "step": "archmaker.environment.compositor"
  },
  "source": "archmaker-rules",
  "ruleId": "RULE-COMP-001",
  "suggestions": ["Keep a single compositor selection."],
  "correlationId": "22222222-2222-4222-8222-222222222222"
}
